{
  "$ref": "#/definitions/navigation",
  "definitions": {
    "navigation": {
      "type": "array",
      "items": {
        "type": "object",
        "properties": {
          "id": {
            "type": "string"
          },
          "title": {
            "type": "string"
          },
          "href": {
            "type": "string"
          },
          "icon": {
            "type": "string"
          },
          "order": {
            "type": "number",
            "default": 0
          },
          "description": {
            "type": "string"
          }
        },
        "required": [
          "id",
          "title",
          "href"
        ],
        "additionalProperties": false
      }
    }
  },
  "$schema": "http://json-schema.org/draft-07/schema#"
}